{
  "$schema": "https://presio.ch/schema/plugin-manifest.schema.json",
  "presio": 1,
  "name": "join-code",
  "displayName": "Join Code",
  "version": "1.1.0",
  "author": "Presio",
  "description": "Put the session's join code up on every viewer screen from a button in the controller's bottom bar, or the C key.",
  "main": "index.html",
  "surfaces": ["background", "viewer"],
  "activation": ["always"],
  "permissions": [],
  "contributes": {
    "commands": [{ "id": "toggle", "title": "Show join code", "icon": "qr-code" }],
    "buttons": [
      {
        "command": "toggle",
        "location": "controller.toolbar",
        "label": "Join code",
        "tooltip": "Show the join code on every viewer screen"
      }
    ],
    "keybindings": [{ "command": "toggle", "keys": [{ "key": "c" }] }],
    "settings": {
      "heading": {
        "type": "string",
        "default": "Join this presentation",
        "maxLength": 80,
        "description": "Text above the code."
      },
      "showUrl": { "type": "boolean", "default": true, "description": "Show the join link under the code." }
    }
  }
}
