{
  "$schema": "https://presio.ch/schema/plugin-manifest.schema.json",
  "presio": 1,
  "name": "notes",
  "displayName": "Speaker Notes",
  "version": "1.0.0",
  "author": "Presio",
  "description": "Your speaker notes for the current slide, read from the PDF, on your dashboard only. Click them to edit; edits are saved into the deck.",
  "main": "index.html",
  "surfaces": ["panel"],
  "activation": ["always"],
  "permissions": ["deck", "editDeck"],
  "contributes": {
    "panels": [{ "id": "notes", "title": "Speaker Notes" }],
    "settings": {
      "fontScale": {
        "type": "number",
        "default": 1,
        "minimum": 0.75,
        "maximum": 2.5,
        "description": "Notes text size, as a multiple of the default."
      }
    }
  }
}
